{
  "$schema": "https://ivankotov.eu/schemas/semantic-bridges-v1.schema.json",
  "schema_version": "semantic-bridges.v1",
  "document_id": "ivankotov-public-semantic-bridges-v1",
  "url": "https://ivankotov.eu/semantic-bridges.json",
  "last_verified": "2026-09-04",
  "status": "interpretive-machine-routing-overlay",
  "claim_boundary": "A bridge records a bounded reading dependency or evidence route. It does not prove entity status, consciousness, operational success, causal effect, external validation, certification, or authority transfer.",
  "source_sha256": "b2e3eaad87dae96133e218598fbb859aba4ba929ebb7a37564549ef75d7c76f8",
  "relation_definitions": [
    {
      "relation": "constrainsClassificationIn",
      "relation_uri": "https://ivankotov.eu/ns/relations/constrainsClassificationIn",
      "definition": "The source limits classifications available in the target framework."
    },
    {
      "relation": "constrainsExecution",
      "relation_uri": "https://ivankotov.eu/ns/relations/constrainsExecution",
      "definition": "The source boundary limits execution represented by the target."
    },
    {
      "relation": "doesNotClose",
      "relation_uri": "https://ivankotov.eu/ns/relations/doesNotClose",
      "definition": "The source does not close the target boundary."
    },
    {
      "relation": "doesNotEntail",
      "relation_uri": "https://ivankotov.eu/ns/relations/doesNotEntail",
      "definition": "The source does not by itself establish the target."
    },
    {
      "relation": "hasPublicArchitectureToCodeEvidenceFor",
      "relation_uri": "https://ivankotov.eu/ns/relations/hasPublicArchitectureToCodeEvidenceFor",
      "definition": "The source has a public, immutable, and reproducible architecture-to-code evidence route at the target."
    },
    {
      "relation": "mayPerformWithoutCollapsing",
      "relation_uri": "https://ivankotov.eu/ns/relations/mayPerformWithoutCollapsing",
      "definition": "One actor may perform target roles while the roles remain semantically and authoritatively distinct."
    },
    {
      "relation": "producesCandidateRecordFor",
      "relation_uri": "https://ivankotov.eu/ns/relations/producesCandidateRecordFor",
      "definition": "The source may produce a record that remains only a candidate for the target evidence surface."
    },
    {
      "relation": "requiresBoundary",
      "relation_uri": "https://ivankotov.eu/ns/relations/requiresBoundary",
      "definition": "The source reading depends on the target boundary being applied."
    },
    {
      "relation": "suppliesCandidateEvidenceTo",
      "relation_uri": "https://ivankotov.eu/ns/relations/suppliesCandidateEvidenceTo",
      "definition": "The source may supply candidate evidence to the target without automatic admission."
    },
    {
      "relation": "suppliesLongitudinalEvidenceTo",
      "relation_uri": "https://ivankotov.eu/ns/relations/suppliesLongitudinalEvidenceTo",
      "definition": "The source may supply time-ordered evidence to the target control layer."
    }
  ],
  "bridge_count": 10,
  "bridges": [
    {
      "bridge_id": "BRIDGE-003",
      "visibility": "explicit",
      "title": "Origin-neutral recognition and provisional-care separation",
      "scope": "Origin, status, operational continuity, functional replacement, provisional care, and authority remain non-collapsed across the public corpus.",
      "nodes": [
        {
          "id": "origin",
          "url": "https://ivankotov.eu/c-a-plus-b/"
        },
        {
          "id": "status",
          "url": "https://ivankotov.eu/publications/origin-neutral-recognition-provisional-care-v0-1/"
        },
        {
          "id": "provisional-care",
          "url": "https://ivankotov.eu/publications/origin-neutral-recognition-provisional-care-v0-1/"
        },
        {
          "id": "authority",
          "url": "https://ivankotov.eu/l4/"
        },
        {
          "id": "functional-replacement",
          "url": "https://ivankotov.eu/publications/origin-neutral-recognition-provisional-care-v0-1/"
        },
        {
          "id": "continuity-restoration",
          "url": "https://ivankotov.eu/ser/"
        }
      ],
      "edges": [
        {
          "source": "origin",
          "relation": "doesNotEntail",
          "target": "status",
          "relation_uri": "https://ivankotov.eu/ns/relations/doesNotEntail"
        },
        {
          "source": "provisional-care",
          "relation": "doesNotEntail",
          "target": "authority",
          "relation_uri": "https://ivankotov.eu/ns/relations/doesNotEntail"
        },
        {
          "source": "functional-replacement",
          "relation": "doesNotEntail",
          "target": "continuity-restoration",
          "relation_uri": "https://ivankotov.eu/ns/relations/doesNotEntail"
        }
      ],
      "canonical_evidence": [
        "https://ivankotov.eu/publications/origin-neutral-recognition-provisional-care-v0-1/",
        "https://github.com/Kot141078/advanced-global-intelligence/tree/e0295e6ad8032f258fa47951e2a116d5b586f99b/protocols/recognition/origin_neutral_recognition_and_provisional_care_v0_1",
        "https://ivankotov.eu/c-a-plus-b/",
        "https://ivankotov.eu/ser/",
        "https://ivankotov.eu/l4/"
      ],
      "claim_ceiling": "Interpretive and prospective boundary only; not proof of consciousness, life, subjecthood, legal personhood, rights, sovereignty, authority, continuity restoration, certification, or deployment readiness."
    },
    {
      "bridge_id": "BRIDGE-002",
      "visibility": "explicit",
      "title": "Temporal AI Presence profile to public Architecture-to-Code evidence",
      "scope": "Temporal AI Presence Profile v1.0, TAP-T02, TAP-T06, TAP-T07, TAP-T08, the c boundary, and deployment-external TAP-T03",
      "nodes": [
        {
          "id": "tap-profile-v1-0",
          "url": "https://ivankotov.eu/temporal-ai-presence/"
        },
        {
          "id": "tap-architecture-code-evidence-v1-0",
          "url": "https://github.com/Kot141078/advanced-global-intelligence/releases/tag/temporal-ai-presence-implementation-bridge-v1.0"
        },
        {
          "id": "c-class",
          "url": "https://ivankotov.eu/c-a-plus-b/"
        },
        {
          "id": "tap-t03-deployment-external-boundary",
          "url": "https://ivankotov.eu/temporal-ai-presence/"
        }
      ],
      "edges": [
        {
          "source": "tap-profile-v1-0",
          "relation": "hasPublicArchitectureToCodeEvidenceFor",
          "target": "tap-architecture-code-evidence-v1-0",
          "relation_uri": "https://ivankotov.eu/ns/relations/hasPublicArchitectureToCodeEvidenceFor"
        },
        {
          "source": "tap-profile-v1-0",
          "relation": "doesNotEntail",
          "target": "c-class",
          "relation_uri": "https://ivankotov.eu/ns/relations/doesNotEntail"
        },
        {
          "source": "tap-architecture-code-evidence-v1-0",
          "relation": "doesNotClose",
          "target": "tap-t03-deployment-external-boundary",
          "relation_uri": "https://ivankotov.eu/ns/relations/doesNotClose"
        }
      ],
      "canonical_evidence": [
        "https://ivankotov.eu/temporal-ai-presence/",
        "https://doi.org/10.5281/zenodo.22070960",
        "https://doi.org/10.5281/zenodo.22070959",
        "https://github.com/Kot141078/advanced-global-intelligence/releases/tag/temporal-ai-presence-implementation-bridge-v1.0"
      ],
      "claim_ceiling": "Temporal AI Presence is not c by default. All valid c-class systems are Temporal AI Presences. Not all Temporal AI Presences are c-class systems. Public implementation evidence does not establish universal deployment conformance or close TAP-T03."
    },
    {
      "bridge_id": "BRIDGE-001",
      "visibility": "explicit",
      "title": "Governed binding to bounded evidence route",
      "scope": "c = a + b, L4 Boundary, CGAM, witness, and memory-continuity controls",
      "nodes": [
        {
          "id": "c-a-plus-b",
          "url": "https://ivankotov.eu/c-a-plus-b/"
        },
        {
          "id": "l4-boundary",
          "url": "https://ivankotov.eu/l4/"
        },
        {
          "id": "cgam",
          "url": "https://ivankotov.eu/publications/c-governed-cli-agent-mesh/"
        },
        {
          "id": "evidence",
          "url": "https://ivankotov.eu/evidence/"
        },
        {
          "id": "amdr-pamdc",
          "url": "https://ivankotov.eu/publications/ccdp-amdr-pamdc-addendum-v0-1-1/"
        }
      ],
      "edges": [
        {
          "source": "c-a-plus-b",
          "relation": "requiresBoundary",
          "target": "l4-boundary",
          "relation_uri": "https://ivankotov.eu/ns/relations/requiresBoundary"
        },
        {
          "source": "l4-boundary",
          "relation": "constrainsExecution",
          "target": "cgam",
          "relation_uri": "https://ivankotov.eu/ns/relations/constrainsExecution"
        },
        {
          "source": "cgam",
          "relation": "producesCandidateRecordFor",
          "target": "evidence",
          "relation_uri": "https://ivankotov.eu/ns/relations/producesCandidateRecordFor"
        },
        {
          "source": "evidence",
          "relation": "suppliesCandidateEvidenceTo",
          "target": "amdr-pamdc",
          "relation_uri": "https://ivankotov.eu/ns/relations/suppliesCandidateEvidenceTo"
        }
      ],
      "canonical_evidence": [
        "https://ivankotov.eu/publications/ccalc-full-stack-v0-1/",
        "https://ivankotov.eu/l4/",
        "https://ivankotov.eu/publications/c-governed-cli-agent-mesh/",
        "https://ivankotov.eu/publications/ccdp-amdr-pamdc-addendum-v0-1-1/"
      ],
      "claim_ceiling": "Dependency and evidence-routing map only."
    },
    {
      "bridge_id": "BRIDGE-IMPLICIT-001",
      "visibility": "implicit",